content,name
徐天堂看到乐少没事是想哭吧，到手的正梅又没了,使徒行者2
康sir让卓凯 看的桌面档案，那三个人是谁,使徒行者2
林峰、佘诗曼、沈震轩,使徒行者2
前一整子网络上上传新的消息：《使徒行者3》演员是原班人马；从而没有提到“萱萱是否还继续饰演施嘉丽”和“陈豪”？,使徒行者2
我的看法是：“魏德信”能不能死而复生，毕竟他答应过“施嘉丽”一定回来还带她离开香港；周游世界过着“平凡，无忧无虑，幸福，美好，快乐”生活；而远在“美国加拿大的“魏德信的,使徒行者2
魏松山”和弟弟”，知道（香港长信，魏家）出了这么大事情，有所行动吧！,使徒行者2
“卓凯”对“施佳丽”说过：重新开始，让“施嘉丽”对将来新生活充满希望，这世上还有“卓凯，郑淑梅”这么多好朋友一起等待她出狱迎接新生活开始；这世上除了“魏德信”能给“施嘉丽”很好的“生活，归属”，还有“卓凯“能做到给”施嘉丽“一样的”幸福生活,使徒行者2
“郑淑梅与徐天堂”已经定下啦！最终他（她）们会在一起，至于“乐少”又跟“秦欢喜”去泰国又做会老本行，他与“郑淑梅”最终无缘啦！,使徒行者2
使徒行者2乐少锋送郑淑梅的密码本是什么啊,使徒行者2
使徒行者II 21集预告：Cherry被抓  Ben究竟会不会开枪杀死女友,使徒行者2
使徒行者2，第25集预告完整，这个蒙面的是谁？,使徒行者2
使徒行者2 堂梅cp虐甜cut,使徒行者2
使徒行者2: 剧中人物身份猜测,使徒行者2
使徒行者II 25集剧情：乐少峰引女黑警现身 最终还是干掉了女黑警,使徒行者2
女生唱的那首叫（安守本分）谷微的,使徒行者2
使徒行者2reinvention,使徒行者2
速龙是黑警，毫无疑问,使徒行者2
速龙应该是，想想他是怎么出场的，还有泰国的爆炸是不是有人安排,使徒行者2
爆炸肯定是有问题的，速龙黑警不会错了，而且很可能是第三势力的黑警，第二势力（许sir到顶了），不过我真的没想到许sir也他妈是黑警,使徒行者2
@ 玄玑决：第一部看的时候哭惨了，不过第一部黑警到了卓sir师傅就停止了，后面扯出了消防部局长，吓了我一大跳。。。,使徒行者2
第一，在泰国，那么大的爆炸，别人死了，他没死，这本身就值得怀疑。有可能就是他引爆的炸弹！他才躲过一劫。,使徒行者2
第二，在第一的假设基础上退一步，可能他真的没被炸死，他确实怀疑卓凯是黑警，自己潜逃回香港，那么他也是会被那帮真正的黑警发现，然后由那帮黑警告诉他，卓凯才是炸弹事故真凶，为了伸张正义，他和黑警合作，回到卓凯身边，干掉卓凯和他的卧底，由此，他便由高层安排，用一个偶然的机会，回到卓凯身边。,使徒行者2
第三，在ben给他的手下布置和速龙联系的任务时，有没有注意到，那帮手下明显是做戏给卓凯看，目的就是让卓凯来接下这个活，让速龙顺理成章的出现。你想，那时黑化的ben有过安排行动故意让卓凯知道的吗？这明显反常，加上速龙对泰国事件的解释，别说卓凯，换做是我，我也会起疑心。何况，卓凯本身比我们这些观众还谨慎的。,使徒行者2
第四，也就是很多观众说的，速龙出现前，欢喜哥那么大派头，长兴和黑钱集团都在找他，却愣是找不到他。而速龙出现后，估计就那么几天，长兴就杀过来找乐少了。而且，速龙还拉着娱乐城去买东西，做出了不在场证明。,使徒行者2
插播一条：如果有人说娱乐城才是黑警，这根本是无稽之谈，出卖欢喜哥跟出卖乐少，哪个更有价值？如果娱乐城是黑警，欢喜哥就不会那么全身而退咯…,使徒行者2
第五，看宣传片，娱乐城似乎有不轨的举动，而速龙识破后，第一想法就是勒死娱乐城，看过前面剧情嗯都知道，卓凯手下的人，除非有紧急情况，才能使用暴力制止犯罪，而看那个镜头，速龙并没有遇到紧急情况，就要勒死娱乐城，这只能说是要做出某个假象了。而娱乐城喊出卓凯，这就说明，这是卓凯布的局，我们神勇无比的卓凯，也怀疑到了速龙。,使徒行者2
第六，看过tvb电视剧，尤其是使徒1的都知道，tvb是不会无缘无故的让一个熟脸出现的，要么是忠，要么是奸，而在使徒电视剧里，奸角会更多一些…甚至，全是奸角，从一哥，到新的卧底,使徒行者2
插播第七，与第二条相悖的推断，速龙就是黑警，泰国事件是他干的。回到香港，他原本是帮黑警收集情报为生，但是卓凯查案导致黑警不得不再次启用对卓凯了如指掌的速龙，用他来干掉卓凯和一帮卧底，这也不难理解，他跟娱乐城借口下楼，明明看到了长兴的车，而故作视而不见了…而长兴的人，也在行动前，通知他离开了。此时大家也要看到卓凯的对策，那就是娱乐城也跟着说一起出去咯，明显就是监视速龙咯,使徒行者2
可是……天堂也不能殺樂少呀！臥底又不能殺人,使徒行者2
《使徒行者2》男人不坏女人不爱,使徒行者2
魏德信第一次向施小姐求婚遭到拒绝，因为在这之前，魏德信一直表现出一个好男人的形象，对施小姐的要求言听计从，为她无条件付出和牺牲，还为她当过子弹。,使徒行者2
看使徒行者2，我不经又想起了Laughting哥。,使徒行者2
終於有人跟我想的一樣了!要是謝天華也來使徒2嘎一角有多讚!,使徒行者2
laughing,使徒行者2
这两天也在听，谢谢分享！,使徒行者2
背景音乐做得很好！给本剧加分不少！,使徒行者2
楼主知道使徒行者2泰国风的音乐叫什么吗,使徒行者2
楼主，音乐在哪找的？求连接,使徒行者2
有mp3百度云吗,使徒行者2
啊啊 楼主MP3链接怎么还没发,使徒行者2
这背景音乐好高级！,使徒行者2
楼主你在哪里找的,使徒行者2
使徒行者2[2017.10.26]这部大热港剧，内核比第一部,使徒行者2
使徒行者2的结局都对不起我第一次买的会员,使徒行者2
小小作业问卷关于《使徒行者2》，谢谢大家帮忙~~~~,使徒行者2
使徒行者2综艺节目,使徒行者2
使徒行者II  21集剧情：Ben痛下心来最终亲手杀死了Cherry,使徒行者2
使徒行者2在第一部前面发生的？？？,使徒行者2
女黑警最后收到一条短信 到底是什么,使徒行者2
是不是许SIR发的,使徒行者2
乐少身中两枪都没死,使徒行者2
21后面有资源不,使徒行者2
21后面有资源不,使徒行者2
这个女黑警早就该死了。,使徒行者2
气死我了，看不到美腿了该死的乐少,使徒行者2
使徒行者2: 剧中人物身份猜测 辨忠奸,使徒行者2
使徒行者2 可以说是第一部的衍生剧情,使徒行者2
刚把使徒行者2 10集追完,使徒行者2
只想说编剧脑洞大开,使徒行者2
跟第一季结尾 欢喜哥资料被删 搭上主线,使徒行者2
原来欢喜哥也是卧底 只不过自己删除了身份资料,使徒行者2
第一集在泰国的五个卧底被炸身亡 其中肯定有黑警 有一个活下来了在后续肯定会以新身份出现,使徒行者2
天堂哥应该也是卧底 15集预告看得出眼神 萱萱应该是反水卧底,使徒行者2
魏德信应该不是大BOSS 幕后应该有一个更大的操盘者,使徒行者2
反正除了陈豪其他都是uc,使徒行者2
五个卧底里面黑警肯定是男的，另外卓凯徒弟朱志斌应该是黑警,使徒行者2
有人说周柏豪可能是黑警………,使徒行者2
插一句 好希望乐少 阿梅在一起,使徒行者2
幕后的大BOSS应该是卓凯,使徒行者2
乐少黒警？施嘉莉前退休卧底，变黑？终极卧底卓凯一出，谁与争锋！,使徒行者2
卓凯徒弟朱sir是黑警，乐少不是但是被徐天堂打死了，是迫不得已的,使徒行者2
三哥最不可能是黑警啊，怎么会有人觉得他是黑警,使徒行者2
那泰国死的五个，我也觉得那个老一点估计是黑警卧底，为啥桌凯他们什么斗办完了通知他开车过来接应下一步，结果他说开太快，车子冒烟过不去了，而且桌凯说过他的车技最好了。所以我觉得他有可能。,使徒行者2
其他看法跟大家差不多，萱萱也一定是卧底，至于好坏现在还不能确认,使徒行者2
不过确认的是，桌凯真的是克亲朋好友啊,使徒行者2
身边跟他近点的，都难逃一死,使徒行者2
你看的真仔细！总算有人认真讨论剧情了！,使徒行者2
卓凯故意想引黑警现身 或者是第五个卧底出来见面,使徒行者2
卓凯的徒弟Ben 暂时还不能扣上黑警的帽子,使徒行者2
只是不知道卓凯要干嘛 想一探究竟,使徒行者2
这女的警察到底是谁？？感觉突然冒出来的，速龙长啥样啊，我忘了,使徒行者2
乐少单挑黑警那么6的吗,使徒行者2
各位，我问女警是什么人，并不是问她是不是黑警，她是黑警谁看不出来？？？我是问她的背景，庸俗的人,使徒行者2
开口脆，一句国语不想听了。。,使徒行者2
这个女警是《诡探》里的女主角吧！,使徒行者2
表面上乐少是卧底,使徒行者2
看了预告，估计乐少在25-30集以后才会死吧,使徒行者2
第一集女黑警出现过,使徒行者2
不懂干嘛要说乐少是黑警，就算有，也是假象,使徒行者2
乐少应该不会是黑警 就算有也肯定会反转,使徒行者2
**。国语没了港片的特色,使徒行者2
马德，突然发现23.24的预告都被删了，预告还有不能传的嘛,使徒行者2
乐少是黑警？那这是哪出？,使徒行者2
乐少就好比爆Seed,使徒行者2
魏德信有二个儿子一个是seed.还有个就是乐少,使徒行者2
为啥我腾讯视频只更新到了20集的呀,使徒行者2
乐少跑去杀人？？？是不想好好当卧底了吗,使徒行者2
晚上给大家继续上传,使徒行者2
我打赌 卓凯肯定会来救Cherry,使徒行者2
Ben根本就没开枪,使徒行者2
女黑警又给他安排一个任务 才能救他女友,使徒行者2
肯定杀了，不然后面还能活,使徒行者2
没死 后来有穿婚纱的片段,使徒行者2
死了，最后结局桌sir才是最大的黑警，魏德信才是卧底,使徒行者2
只有猜fing在认真的混黑社会,使徒行者2
他当卧底，太厉害了，昨晚通宵看完剧集，太开心了,使徒行者2
粤语版，越看越刺激,使徒行者2
想要全集找我 v,使徒行者2
sillinjing,使徒行者2
使徒行者2乐少锋送郑淑梅的密码本是什么啊,使徒行者2
#使徒行者2#  大结剧 一起看   不要钱,使徒行者2
使徒行者2不是使徒行者1的前传，很可能是前前前传！,使徒行者2
跪求 使徒行者2第28集乐少和阿梅餐厅吃饭时的背景钢琴曲? Orz,使徒行者2
使徒行者1-2季全集粤语国语,使徒行者2
使徒行者2最终卧底,使徒行者2
使徒行者2,使徒行者2
求大神给使徒行者2安守本分原曲，感谢,使徒行者2
使徒行者1.2都有，今晚更新20-25，进来拿，二楼哦,使徒行者2
谁知道使徒行者2第29集中覃欢喜和卓sir吃饭时那个钢琴插曲,使徒行者2
　　使徒行者2第四集的英文插曲歌词介绍　　歌名：A Trip,使徒行者2
使徒行者2在第一部前面发生的？？？,使徒行者2
背景音乐真的很赞,使徒行者2
Cherry也挺可怜的,使徒行者2
哎，虽然演技不行，但是背景音乐赞，还是很触动人,使徒行者2
不懂他干嘛开三枪那么狠完全就是要对方死,使徒行者2
看完正剧意犹未尽的可以再追追     貌似是今晚在TVB直播了   到时候网上搜搜看看能不能看,使徒行者2
使徒行者2的结局都对不起我第一次买的会员,使徒行者2
那第三部恐怕要在对不起你一次了,使徒行者2
这部大热港剧，内核比第一部更深刻,使徒行者2
整整追了一个多月的《使徒行者2》终于落下了大幕！,使徒行者2
中间熬不住等剧的空档，又翻出了第一部剧集来看。,使徒行者2
对比之下，越发感觉到了第二部中，编剧在探索人性方面走得更远。,使徒行者2
在剧情上，第二部是第一部的前传，而在精神内核上承接的却是,使徒行者2
使徒行者2结局康sir桌上摆的3张卧底照片是谁?,使徒行者2
使徒行者II 23集剧情：Ben警局挟持女黑警 被大黑警许SIR一枪爆头,使徒行者2
使徒行者II 27集预告：徐天堂救下兰姨 魏德信质问徐天堂的身份,使徒行者2
《使徒行者2》刑事情报高级督察卓凯（苗侨伟 饰）现身泰国曼谷,使徒行者2
使徒行者2,使徒行者2
谁知道使徒行者2第29集中覃欢喜和卓sir吃饭时那个钢琴插曲，就是乐少死了后，覃欢喜找卓sir吃饭时那个钢琴曲，大神求解,使徒行者2
我也想知道，很多集都有出现的,使徒行者2
使徒行者1.2都有，今晚更新20-25，进来拿，二楼哦,使徒行者2
abing18161,使徒行者2
求大神给使徒行者2安守本分原曲，感谢,使徒行者2
callmynameJD,使徒行者2
大胆预测:使徒行者2最终卧底:   魏德信,使徒行者2
1.剧情综上说他参加过美军,使徒行者2
2.消灭社团老成员但是没有杀他父亲,使徒行者2
3.选择当过军情六处特勤人员萱萱做拍档,使徒行者2
4.渗入更高一层毒品洗黑钱组织接洽,使徒行者2
5.目的应该是消灭挖出更高一层正在的幕后黑手,使徒行者2
之前选择的时候不知道施嘉莉是英国卧底,使徒行者2
之前选择的时候不知道施嘉莉是英国卧底,使徒行者2
他一出现就杀了两个人，怎么可能是卧底？,使徒行者2
要是真的脑洞就太大了，国际刑警的卧底,使徒行者2
其实这部片全都是卧底,使徒行者2
你不如说，警察都是黑警，,使徒行者2
我也觉得魏德信是卧底，利用自己,使徒行者2
家庭背景为便，调查跨国洗黑钱集团。但不是香港卧底，属于美国军方。所以跟卓sir他们有对手戏是必须的。各自为自己的警队卖力。,使徒行者2
卓sir的徒弟是黑警，别问为什么，我看了预告,使徒行者2
这样好像挺有意思~可是整部剧不是白斗了嘛~,使徒行者2
朱志彬是黑警，黎sir上司是大boss,使徒行者2
但是他杀了乐少 不可能是卧底,使徒行者2
1.参加过美军就不能是,使徒行者2
2.清理社团是为了更好掌握社团，方便他做事。,使徒行者2
，而且后来也交待了，看中的是她的能力还有喜欢她仅此而已。,使徒行者2
4.更新的剧情里,使徒行者2
使徒行者1-2季全集粤语国语，楼下娶,使徒行者2
Abloveme112,使徒行者2
不是安守本分就是忘记我自己,使徒行者2
同求，这首钢琴曲很多集都有出现,使徒行者2
这是不懂撒娇的女人？,使徒行者2
使徒行者2不是使徒行者1的前传，很可能是前前前传！,使徒行者2
第三十集的大结局，魏生的兄弟出现了，发誓要为魏生报仇，而那个死了的卧底没死，跟着欢喜哥去态度了，结局是这样的话，就无法解释第一部的剧情了，如果是前传的话，那魏先生和那个没死的卧底可是没有在第一部里出现的啊，这可是在剧情上相互冲突的,使徒行者2
难道前传也要拍好几部？,使徒行者2
第一部说的是2014年的故事，第二部说的是2010年的故事，中间隔了三年，呵呵，编剧可以把这三年再编出来，整好几部前传呢！部,使徒行者2
大结局  一起看  不要钱,使徒行者2
+WX13503300036,使徒行者2
使徒行者2,使徒行者2
推剧使徒行者2维和步兵营大话西游,使徒行者2
谁知道《使徒行者2》23集9分45秒出现的是什么歌曲,使徒行者2
谁知道《使徒行者2》23集9分45秒出现的是什么歌曲？？？？,使徒行者2
期待了三年的使徒行者2就这样结束了？表示这个结局看不懂,使徒行者2
期待了三年的使徒行者2就这样结束了？表示这个结局看不懂,使徒行者2
使徒行者2中好像 没卧底什么事情啊,使徒行者2
使徒行者2大结局,使徒行者2
使徒行者2第25集29分徐天堂的电话铃声，求下载,使徒行者2
更新啦~更新啦~使徒行者2国语、粤语都有，天泪传奇之凤凰无双,使徒行者2
使徒行者2 看的我很热血沸腾 来来来    有一起看的吗,使徒行者2
使徒行者2 看的我很热血沸腾 来来来  有一起看的吗,使徒行者2
心疼天堂哥一个大暖男，是阿梅的万年备胎,使徒行者2
希望有第三部，能给天堂哥一个妹子，我还等着看天堂哥的身材,使徒行者2
郑淑梅压根配不上天堂，自私到没朋友,使徒行者2
乐少很有担当和独立，天堂则是全心全意现在朋友的立场为乐少和正梅着想，非常正直，没有趁虚而入,使徒行者2
天堂哥本来有女朋友，不过4月1号被抢了,使徒行者2
乐少，天堂应该都不喜欢阿梅，只是当妹妹的呵护！只不过，不过方法不同！这点还得需要大家细看！,使徒行者2
阿梅这么重感情的人，真的适合当卧底吗？,使徒行者2
同希望天堂哥能有一段正经的爱情,使徒行者2
哎很希望正妹竜选我们天堂阿,使徒行者2
没有天堂，阿梅会被烟仔搞了，，，然后会被大辉抓到装了窃听器，然后她妈会被赌坊扣住。。。天堂根本就是守护天使般的存在,使徒行者2
使徒行者2，又名:论备胎的修养,使徒行者2
我也喜欢天堂甚过乐少啊..,使徒行者2
《使徒行者2》刑事情报高级督察卓凯（,使徒行者2
徐天堂适合做老大,使徒行者2
天堂就适合当老大,使徒行者2
这个兰姨真是坑女啊,使徒行者2
超级喜欢天堂这样的,使徒行者2
张雪情的老母？女黑警的老妈？,使徒行者2
是下周一更新对吧,使徒行者2
1-30集  ➕V       yuzaipz,使徒行者2
感觉徐天堂最后会死，哎，还蛮喜欢徐天堂的,使徒行者2
最后几集的剧情发展的有些快,使徒行者2
这部片警察都是好枪法,使徒行者2
我一直都是个好警察,使徒行者2
许不是黑警，你是不是傻,使徒行者2
卓凯这时候已经开始怀疑许sir是黑警了，眼神都不一样了！,使徒行者2
前几集那个那个民间卧底不是拍到张警司的照片了吗，为什么卓还这种表情,使徒行者2
这女的演技比ben好多了，眼神到位,使徒行者2
使徒1-30泄露版结局来啦，思我不要qian,使徒行者2
是施加莉和乐少吗？,使徒行者2
使徒行者1主角，这是彩蛋,使徒行者2
使徒行者2是使徒行者的前集,使徒行者2
哦.这是第一部的卧底了啊！,使徒行者2
第一部的卧底，第二部应该是第一部的前传，因为第一部开头就说康sir死掉了，第二部里还这么活跃,使徒行者2
明显是钉姐和林峰,使徒行者2
连浩勤 丁小嘉  薛家强,使徒行者2
乐少有没有死啊，最后？,使徒行者2
你明明说三张照片，怎么只说两个人，另一个又是谁呢,使徒行者2
竟然没看过第一部,使徒行者2
我个人感觉第一部应该跟第二部反着来拍，剧情颠倒了,使徒行者2
第二部黑警刚刚消灭完，第一部又都是黑警出现，真是太疯狂了,使徒行者2
剧情不对呀 第一部没有马国明 好假,使徒行者2
那是第一部的卧底，另外那个男的叫Kobe,使徒行者2
去看看第一部吧 第一部比第二部好看 演员也演得更好。,使徒行者2
我觉得第三部的故事是第二部之后，第一部之前,使徒行者2
是第一部的卧底，佘诗曼，林峰，第一部里面康sir也被暗杀了,使徒行者2
林峰(小混混)，佘诗曼，洗脚妹，覃欢喜和一个女人生的女儿。,使徒行者2
其实我觉着关键是tvb的群演太少了，很多给人留悬念的人物，给个正面描写就这么难吗？害的大家猜来猜去。。。,使徒行者2
已全集👉看的来nj1152532686 免费,使徒行者2
你没看使徒一吗，这是那里的主角钉姐同爆seed哥啊,使徒行者2
使徒行者2,使徒行者2
使徒行者2  看的我很热血沸腾  来来来有一起看的吗,使徒行者2
使徒行者2  很好看！ 来来来,使徒行者2
使徒行者II 27集剧情：黎SIR的第五个卧底居然黑钱集团的梁思敏,使徒行者2
【使徒行者2】完啦❗❗❗ 第5个卧底终于现身 正义邪恶上演终,使徒行者2
使徒行者2结局,使徒行者2
💟💭使徒行者21-30集 完结‼️完结‼包更新的宝宝已发🙆全,使徒行者2
使徒行者II 26集剧情：速龙利用娱乐城当替死鬼 卓凯揪出速龙黑警,使徒行者2
介绍使徒行者2和踩过界的，主播声音很好听！！,使徒行者2
使徒行者II 29集预告：乐少被徐天堂亲手杀死 阿梅痛哭流涕,使徒行者2
使徒行者2和潜行狙击是不是也有什么关连的？,使徒行者2
使徒行者2,使徒行者2
使徒行者2 看的我很热血沸腾 来来来,使徒行者2
加v 2900229119,使徒行者2
使徒行者2 看的我很热血沸腾 来来来,使徒行者2
加v 2900229119,使徒行者2
不是资源党 纯属分享,使徒行者2
更新啦~更新啦~使徒行者2国语、粤语都有，天泪传奇之凤凰无双，蔚蓝50米，天才枪手，羞羞的铁拳，缝纫机乐队，心灵猎人，白夜追凶，高能医少，极盗车神，追龙，只要你想看，我就能给你~,使徒行者2
使徒行者2第25集29分徐天堂的电话铃声，求下载,使徒行者2
使徒行者2终于追完了，国语，奥语都有，想看的你快Q1,使徒行者2
不是汁源党，不要💰给你看,使徒行者2
15308740089,使徒行者2
如题   陈豪被欢喜打死   欢喜被,使徒行者2
期待了三年的使徒行者2就这样结束了？表示这个结局看不懂,使徒行者2
追个剧我也是够辛苦的,使徒行者2
看完了2决定在把1看一遍,使徒行者2
粤语版的另一番感觉,使徒行者2
还有两个镜头没看懂,使徒行者2
期待了三年的使徒行者2就这样结束了？表示这个结局看不懂,使徒行者2
为了追剧也是好辛苦,使徒行者2
估计等你看到第三部就懂了,使徒行者2
第二部跟第一部颠倒的 懂吗,使徒行者2
所以这一部并没有解释任何一部,使徒行者2
只是增加了更多的埋伏,使徒行者2
结局编不下去了？太狗血了,使徒行者2
这个结局就为了告诉你还有第三部,使徒行者2
谁知道《使徒行者2》23集9分45秒出现的是什么歌曲？？？？？？,使徒行者2
是不是叫《迷恋》啊？,使徒行者2
找到了说一声，我也想知道,使徒行者2
可爱的楼主回来了,使徒行者2
楼楼的主页简介看看哦,使徒行者2
总是被删帖的我很无奈╮（╯＿╰）╭,使徒行者2
点一下左上角楼楼的头像,使徒行者2
进入到楼楼的主页,使徒行者2
有个   主动开头的,使徒行者2
求使徒行者2第十集开头的纯音乐，背景音乐,使徒行者2
使徒行者2 真的是太难看了,使徒行者2
使徒行者2的三大最,使徒行者2
使徒行者2,使徒行者2
有没有使徒行者2的电视原声？,使徒行者2
谁有使徒行者2主题曲，片尾曲？,使徒行者2
使徒行者2的全剧概括就一句话:黑社会都去做警察，警察都去做黑,使徒行者2
美瞳#使徒行者2大结局##9成韩国艺人月入30...#,使徒行者2
使徒行者2和潜行狙击是不是也有什么关连的？,使徒行者2
潜行里前阿嫂袁君岚是福和的老大的女儿，福和里也有个叫垯Q的，形象和使徒2里的那个很像,使徒行者2
正想我也有这个疑惑,使徒行者2
感觉有点类似，都是职业剧的原因吗？,使徒行者2
楼主，有潜行狙击的资源不,使徒行者2
都是同一个公司出的，就是有点串插，台湾原来很多不都也这样,使徒行者2
才更到25，就有29的预告了？,使徒行者2
天啊，那岂不是天堂也要死,使徒行者2
好虐心的一部剧。。,使徒行者2
楼主雷锋精神，我找了好久的预告，终于找齐了。,使徒行者2
徐天堂为什么杀乐少锋？,使徒行者2
估计又是一出戏，最后翻翻身又活过来,使徒行者2
这是第一部的前传，既然第一部没这些卧底，注定是悲剧收场,使徒行者2
不是跟钉姐和爆seed的对白一样吗哈哈哈哈哈哈,使徒行者2
我觉得没死，第一部没这些人可以在第二部结尾交代下各自干嘛去了所以第一部才没提到,使徒行者2
喜欢天堂哥，希望他不要有事,使徒行者2
對呀！天堂不能殺人吧！,使徒行者2
他妈这种人一出来就没好事,使徒行者2
为什么只有一边有泪的,使徒行者2
徐天堂一定要平安无事啊😱真心心疼天堂哥啊，梅姐，体谅滴啦,使徒行者2
反正30集天堂也死了，乐天CP双双飞，剩女主自己玩吧,使徒行者2
天堂这只 备胎真惨,使徒行者2
介绍使徒行者2和踩过界的，主播声音很好听！！,使徒行者2
各位吧友爱不爱我,使徒行者2
千万不要加那些微信给资源的都是骗子,使徒行者2
基本上预告片出现的剧情 扑所迷离我都会上传,使徒行者2
速龙最后的结局 被魏德信开枪打死,使徒行者2
速龙墙边草 两边倒,使徒行者2
💟💭使徒行者2,使徒行者2
结局感觉有点烂   前面乐少死的时候 害我流了多少眼泪哦   现在又复活了  浪费我表情,使徒行者2
