content,name
结局 感觉是有点仓促  前面几个大神分析的很对 Victor那么大一个boss  死的那么简单 身边都没人保护,使徒行者2
最后是照片三个人 是第一部那几个？？？,使徒行者2
结局的乐少应该是他哥 有项链 而且眼神是一个真的卧底,使徒行者2
应该还会有第三部，马国明特别演出,使徒行者2
【使徒行者2】完啦❗❗❗ 第5个卧底终于现身 正义邪恶上演终极对决😏 卧底✔黑警❌你猜对了几个😉,使徒行者2
阿敏被抓之后就再也没出现过,使徒行者2
这个演员叫什么名字啊,使徒行者2
早看完了正在无聊中,使徒行者2
哇，身材很正的好吗，而且穿职业装好性感,使徒行者2
我有，私信我无偿给你，这个和谐发不了,使徒行者2
扮演阿敏的演员叫什么名字？好像之前有见过,使徒行者2
使徒行者2  很好看！ 来来来,使徒行者2
加v 2900229119,使徒行者2
不是资源党 纯属分享  全集,使徒行者2
使徒行者2  看的我很热血沸腾  来来来,使徒行者2
加v  2900229119,使徒行者2
全集免费看  不要💰  从小姐姐那得到的,使徒行者2
看完了前十集，觉得pahko真是有颜值 身手好,使徒行者2
我完全沦陷了啊！,使徒行者2
昨晚还梦到乐少被拖到山上 被人杀死了,使徒行者2
不管你是卧底还是黑警，请你活到最后啊！,使徒行者2
老规矩上图为敬，有兴趣可分享一二季,使徒行者2
感觉袁伟豪比他帅,使徒行者2
挺帅的。比天堂帅。,使徒行者2
我以前听他唱歌的，没想到演技也这么在线  可以听听他的够钟 一事无成 哈哈😄😄,使徒行者2
谁有6-10的网盘啊？粤语版,使徒行者2
以前很喜欢听他的歌，现在觉得他好帅,使徒行者2
预告一下，最后可能会全部瓜！因为第一部卓SIR说过不想自己重复几年前悲剧，全部卧底瓜了！,使徒行者2
谢谢楼主的分享。,使徒行者2
乐少被德信杀了吧,使徒行者2
乐少最后被魏德信杀左，冇活到最后一集,使徒行者2
徐天堂那个演技，那个身材，那个颜值，还有谁…,使徒行者2
楼主，可以分享1-15的资源吗？,使徒行者2
使徒行者2插曲,使徒行者2
使徒行者2最后一集正梅在路边晕倒是怀孕了吗。卓sir还到医院,使徒行者2
使徒行者2《1-30集完整》 公粽号【购物狗】免费看,使徒行者2
使徒行者2结局疑问,使徒行者2
使徒行者2，1--30中文粤语，反黑粤语全，白夜追凶1--3,使徒行者2
#使徒行者2#使徒行者2完结了，需要的来来来,使徒行者2
更新啦！更新啦！会痛的十七岁、使徒行者2（粤语版）、维和步兵,使徒行者2
使徒行者2应该是1的前传，那么预告片3呢？,使徒行者2
使徒行者2结局一点意思也没有。气死了,使徒行者2
谁知道使徒行者2第29集中覃欢喜和卓sir吃饭时那个钢琴插曲,使徒行者2
🏆👑店主推荐销量王👑🏆超好看的自然小直径绿色哟，感觉完全融入眼球的绿色 隐隐透出的绿色光芒不要太美!不会放过的[色]美到没盆友!,使徒行者2
图片上妹子多少钱？,使徒行者2
使徒行者2的全剧概括就一句话:,使徒行者2
都去做警察，警察都去做黑社会，黑黑白白，无法分辨……,使徒行者2
大结局了。没剧追了。,使徒行者2
跪求连接！！谢谢,使徒行者2
酷我不是能听么，还有mv,使徒行者2
威cwnqr40，我发给你,使徒行者2
有没有使徒行者2的电视原声？,使徒行者2
我有，加威cwnqr40,使徒行者2
dy.quanlao.shop,使徒行者2
一口气看完后，真的好看，环环相扣,使徒行者2
只是莫名心疼徐天堂 天堂哥，他在背后默默付出了这么多，却还是得不到梅姐的心,使徒行者2
为天堂哥打call!！,使徒行者2
最BUG。许处长是小混混冒充的黑警察，我很奇怪，当卧底的话不用备份资料？即使资料没了，卧底也是联络员选的，也要给联络员情报，难道说真正的许sir的联络员分不清谁真谁假？做警察的没点眼力？如果说假许sir复职前杀了他的联络员更不可能了，因为没人证明他的身份，其实编剧为什么弄这么麻烦又不严谨，不如说为了钱，而且一个小混混复职了就去CIB的老大他有专业知识？去国外留学他懂那些专业吗?即使他在努力也不可能，就好比一个小学没毕业的人直接让他上清华北大有用吗？,使徒行者2
最乱时间线，2部的时间线在1的前面，第一部欢喜哥是从监狱里出来，但是2和1之间的时间线可能只有4年左右，可是欢喜哥杀了魏德信啊，香港没死刑起码也是20年牢吧，而且2部结尾欢喜哥跑了，然后说,使徒行者2
会为魏德信报仇，欢喜哥又杀回香港？他敢吗？他回去就是通缉犯啊，时间线根本对不上，20年啊,使徒行者2
刚看到18集 28分，卓sir都知道,使徒行者2
懂卧底的密码，还当着scarlett的面 和乐少联系，剧情一点都不严谨，乐少和天堂打架像是小孩子过家家一样好假，真的搞不懂为什么有那么多人觉得好看，演员演技不行，剧情不严谨，感觉剧情有些地方是为了让观众惊讶而强行发生的，很突兀，一直喜欢看港片，不管是电影还是电视剧，这是我看过最烂的港片，跟使徒行者这些没得比。。。,使徒行者2
说错，和潜行狙击还有其他港片没得比，我看到现在不知道他们是要干嘛，剧情懒懒散散，想一出是一出,使徒行者2
最可怕的是，这部剧的前档是 同盟，看完同盟再看这部，就觉得这些警察都还没有商人高级，一点都不小心😂😂😂,使徒行者2
第一部好看 这部不行 可能太有钱了我都找不到港味了……,使徒行者2
个人觉得比1好看,使徒行者2
感觉几个年轻演员的演技 都有点小僵硬,使徒行者2
求使徒行者2第十集开头的纯音乐，背景音乐,使徒行者2
我知道有三首     还有一首不知道   Remembering              The Path              The Game Of Life Piano,使徒行者2
Reinvention,使徒行者2
使徒行者2好好看啊,使徒行者2
#使徒行者2大结局#！！！！有需要的可以V哈,使徒行者2
使徒行者2，全集的，要的来私我,使徒行者2
要使徒行者2资源的宝宝们加我,使徒行者2
使徒行者2大结局，没想到死的是魏德信，还以为魏德信和欢喜哥都,使徒行者2
白夜追凶亲爱的王子大人亲爱的公主病使徒行者2,使徒行者2
#使徒行者2#,使徒行者2
使徒行者2 很好看哦 大家一起来看吧😄,使徒行者2
使徒行者2 预告片,使徒行者2
使徒行者2主角换人，陈豪饰演反派角色，你期待吗？,使徒行者2
使徒行者2伪前传最有利证据,使徒行者2
使--徒---行-----者-----2 可以kan了 ya,使徒行者2
谁有使徒行者2里的插曲，谷薇的《安守本分》网盘资料啊？拜托传,使徒行者2
使徒行者2，双语言，滋滋我，喵阀~~,使徒行者2
使徒行者2全集已出，要的戳进来。无偿分享。赶紧的！！！！,使徒行者2
谁知道使徒行者2第29集中覃欢喜和卓sir吃饭时那个钢琴插曲，就是乐少死了后，覃欢喜找卓sir吃饭时那个钢琴曲，大神求解,使徒行者2
使徒行者2结局一点意思也没有。气死了,使徒行者2
还可以吧，比以前正宗的更大气一些,使徒行者2
没意思？我觉得很精彩！,使徒行者2
使徒行者2应该是1的前传，那么预告片3呢？马国明要出来。3的发生时间是在1之后，还是在2和1之间？,使徒行者2
3如果是1之前，那么卓凯，欢喜哥和猜FING又无敌了，可以尽情浪。,使徒行者2
觉得使徒行者和无间道三部差不多，第二部是前传，第三部的时间在第二和第一中间,使徒行者2
更新啦！更新啦！会痛的十七岁、使徒行者2（粤语版）、维和步兵营、稍息立正我爱你、国民大生活、宝贝的新朋友，各种各样，你值得拥有哦,使徒行者2
mengtianlei110,使徒行者2
使徒行者2完结了，需要的来来来,使徒行者2
使徒行者2，1--30中文粤语，反黑粤语全，白夜追凶1--32全,使徒行者2
➕薇，备注剧名，通过秒发,使徒行者2
最后出现那个玩枪的，要给魏德信报仇那个是谁？求解,使徒行者2
看眼就知道是马国明了，,使徒行者2
马国明演魏德信弟弟回来复仇,使徒行者2
仁义礼智信，**第二部和第一部之间还能拍4部。,使徒行者2
如果是仁义礼智信温良恭俭让忠孝勇恭廉。。。。十几部。。。。。。,使徒行者2
guan      zhu公粽号【购物狗】免费看,使徒行者2
使徒行者2最后一集正梅在路边晕倒是怀孕了吗。卓sir还到医院问候,使徒行者2
是的，孩子是天堂哥的，最后和欢喜哥去泰国不是乐少，是正妹的儿子，徐天乐,使徒行者2
不是吧，不是因为伤心过度吗,使徒行者2
老奶奶都不扶就服你,使徒行者2
不是吧，怀了谁的啊，服了你的脑洞了，明显是悲伤过度啊,使徒行者2
那护士不是说 饿晕了吗,使徒行者2
求插曲安守本分mp3资源,使徒行者2
有没有人在看使徒行者2  简直不要太好看,使徒行者2
坚持一下，满满的正能量！#使徒行者2# 羞羞的铁拳百度还是追,使徒行者2
？使。徒。行。者。2！！能看了,使徒行者2
#使徒行者2#大结局啦 好看好看,使徒行者2
使徒行者2🔥完结了，26～30,使徒行者2
【使徒行者2】大结局1-30集#(爱心)#(爱心)#(爱心),使徒行者2
刚看完使徒行者2     这结局这彩蛋,使徒行者2
【资源】👀使徒行者2👀dd两下私信免费分享给你哦🐒早上没课就,使徒行者2
使徒行者2，1_30集完整，未剪辑版的可以看了，来一波真爱粉,使徒行者2
使徒行者2，1_30集完整，未剪辑版的可以看了，来一波真爱粉,使徒行者2
使徒行者2,使徒行者2
想看使徒行者2完结+唯❤YYQbibibi1874,使徒行者2
想看使徒行者2完结+唯❤YYQbibibi1874,使徒行者2
使徒行者2全集已出，要的戳进来。无偿分享。赶紧的！！！！,使徒行者2
加维新：ghc19990,使徒行者2
赶紧的。谁还要？,使徒行者2
还有么？。睡觉啦。,使徒行者2
有粤语吗，我想要粤语,使徒行者2
SAY20160101,使徒行者2
谁有使徒行者2里的插曲，谷薇的《安守本分》网盘资料啊？拜托传给我谢谢了,使徒行者2
使--徒---行-----者-----2 可以kan了 yao的来,使徒行者2
味🌟：NK98982,使徒行者2
唯❤️：NK98982,使徒行者2
没吃晚饭 要饿死了,使徒行者2
一个哈哈哈哈回家,使徒行者2
未行：NK98982,使徒行者2
dddddddd,使徒行者2
看完的小伙伴都该知道卓s知道欢喜是警察还是卧底，但在第一部了，卓凯从没提过欢喜身份，并且整部局的表现来看，卓凯好不知情欢喜是有卧底，有个片断，欢喜和手下在足浴，卓凯送去一份有密码的菜单约见面，时候差点被发现也没认为是被欢喜发现了，如果前传在知道欢喜是卧底的情况，第一部还会这么做？被发现了还会找不出原因？所以，导演拍第一部的时候根本没想过会拍第二部，第二部就是强行前传,使徒行者2
第一部里知道欢喜哥以前是警察。是不是卧底好像只在最后几集中有提起，最后一集也有放出他的警察档案。这种戏好看就行，没必要太较真，很多美剧也是经不起推敲,使徒行者2
虽然好久就出来的预告片了还是再发下好了,使徒行者2
我觉得我不会花钱去电影院看，没有佘仔和林峯还有什么意思,使徒行者2
其实我比较好奇有些人不想看咋还会来贴吧留言的？包括使徒2新闻底下也总是有没林佘不看的留言，真的喜欢他俩的话不是早应该知道使徒2没他俩了么？没他俩不想看2的话不是应该忽略么？反正我不想看的根本不会进相关贴吧更懒得点开相关新闻,使徒行者2
腾讯视频首发会不会有粤语版看啊？我好担心会像无间道那样只有国语,使徒行者2
我只看粤语版，谢谢，无间道什么时候出粤语版了我在看,使徒行者2
我有粤语的也有国语的，,使徒行者2
11集什么时候播,使徒行者2
然而我已经看完15集了,使徒行者2
可加vx:c1121421无偿分享哦,使徒行者2
oops-1988,使徒行者2
使徒行者2大结局，没想到死的是魏德信，还以为魏德信和欢喜哥都被卓sir抓了，最后，乐少没死，还跟了欢喜哥,使徒行者2
前传欢喜不能死呀,使徒行者2
只能离开香港，不然回来找卓sir他们会被捉。,使徒行者2
我只在想马国明能不能演好大boss,使徒行者2
要使徒行者2资源的宝宝们加我,使徒行者2
＋v，chenxuan8832,使徒行者2
使徒行者2，全集的，要的来私我,使徒行者2
！！！！有需要的可以V哈,使徒行者2
可以V:w三二零三二四五二一,使徒行者2
使徒行者2好好看啊,使徒行者2
想看使徒行者2完结+唯❤YYQbibibi1874,使徒行者2
使徒行者2后面那个撂枪说要给魏德信报仇的是哪个？求广大好友告,使徒行者2
使徒行者2,使徒行者2
.使徒行者2无偿分享。全集！！！！！要的戳进来,使徒行者2
使徒行者II 27集剧情：徐天堂面对魏德信的质问 回答问题行云流水,使徒行者2
使徒行者2已完结，期待第三季,使徒行者2
苗侨伟在使徒行者2里戴的这块表,使徒行者2
使徒行者2 26-30,使徒行者2
使徒行者2,使徒行者2
想看使徒行者2完结+唯❤YYQbibibi1874,使徒行者2
谢谢楼主无偿分享,使徒行者2
之前是冲着周柏豪追剧的，觉得乐少演得很好,使徒行者2
后来发现我更喜欢徐天堂，有点痞帅痞帅,使徒行者2
整天穿得像个炮王一样撩正梅，性格好好，逗死了,使徒行者2
身材很正点，不愧是香港先生,使徒行者2
乐少留给正梅吧，徐天堂我要了,使徒行者2
哈哈，我开始喜欢乐少，后面被天堂哥勾走了，哈哈，阿梅说他穿得像个鸭王，笑死了,使徒行者2
我还是觉得卓凯最帅,使徒行者2
其实痞帅的才让人讨喜,使徒行者2
刚开始可能喜欢酷帅的，但是痞帅的才会哄人,使徒行者2
这句话已经听过很多遍了,使徒行者2
使徒行者2，1_30集完整，未剪辑版的可以看了，来一波真爱粉，二楼自取👩❤️💋👩👩❤️💋👩,使徒行者2
想看的宝宝们扣1,使徒行者2
使徒行者2，1_30集完整，未剪辑版的可以看了，来一波真爱粉，二楼自取👩❤️💋👩👩❤️💋👩,使徒行者2
想看的宝宝们扣1,使徒行者2
【资源】?使徒行者2?,使徒行者2
一个小姐姐那拿的资源，太好看了。我做个好人想看的我无偿分享给你,使徒行者2
乐少演的既有才华横溢又好开玩笑，充满活力、看得让人少女心爆棚。也有乐少最后留下纸条“对不起，我爱你”时心情妙不可言，我的微   zfz2211,使徒行者2
使徒行者2🔥完结了，26～30,使徒行者2
79048798,使徒行者2
大结局啦 好看好看,使徒行者2
？使。徒。行。者。2！！能看了,使徒行者2
xjjddjjsx,使徒行者2
v:zydd688,使徒行者2
坚持一下，满满的正能量！#使徒行者2# 羞羞的铁拳,使徒行者2
还是追个电视剧看看吧,使徒行者2
长假重温了使徒行者1好看死,使徒行者2
五十度飞预告来了,使徒行者2
五十度系列[微风]使徒行者2粤语,使徒行者2
刚才一位小姐姐给了我全集资源，有没有想一起看的，做个好人无偿分享给你们,使徒行者2
你开会员看全集得多少钱呢？不必花那些钱,使徒行者2
使徒行者2 26-30,使徒行者2
薇yszy1707,使徒行者2
在使徒行者2里戴的这块表是什么牌子啊？上网搜不到！,使徒行者2
"给了TB截图, 但是85把我回复给删了, 帮不了你.",使徒行者2
看看徐天堂的手表吧，那个才是高级货。理查德,使徒行者2
网上都找不到，不会是私人订制的吧,使徒行者2
应该是道具，垃圾表，内地山寨，叫杜兰特，淘宝价128,使徒行者2
十分感谢七楼的朋友，终于知道了,使徒行者2
我的天 好歹来块卡西欧当道具啊,使徒行者2
乐少没死，是我最开心的，本来还跟伤心的来着，哎。故事还没完，期待第三季。,使徒行者2
马国明下一步大boss,使徒行者2
27集预告的剧情,使徒行者2
魏德信开始怀疑徐天堂了,使徒行者2
天堂的笑挺迷人的,使徒行者2
天堂哥是唯一没吃过枪子的人,使徒行者2
乐少开枪打过天堂的手,使徒行者2
乐少 阿梅 看烟花的地方是哪里,使徒行者2
.使徒行者2无偿分享。全集！！！！！要的戳进来,使徒行者2
加维新：ghc19990,使徒行者2
看完使徒行者2，突然觉得最帅的是魏德信，最神奇的是，乐少为哥哥报仇，死了那么多人，包括自己，居然哥哥没死，我就呵呵咯。。。。,使徒行者2
使徒行者2后面那个撂枪说要给魏德信报仇的是哪个？求广大好友告知,使徒行者2
好奇乐少怎么死不去？,使徒行者2
编剧为了强行出续集。。。,使徒行者2
马国明 魏德信弟弟,使徒行者2
问题来了，最后那一下他看起来这么牛，哥哥死之前死哪去了？为了续集好拼啊,使徒行者2
