content,name
【迎接乡十】乡村爱情吧官方交流群：560915095,乡村爱情10
陪我妈恶补了乡村爱情1~10季，发现里面的人变化都好大啊！,乡村爱情10
【乡村爱情10下部】【1-30集】刚`都`看`完了，有想-要的吗？·,乡村爱情10
乡村爱情10保温杯,乡村爱情10
网上定制的乡村爱情10周边物品，保温杯,乡村爱情10
乡村爱情1到10都看了吗,乡村爱情10
乡村爱情10真的垃圾到爆，简直侮辱人的智商，,乡村爱情10
乡村爱情1-10高清  想看进来拿,乡村爱情10
乡村爱情10剧照,乡村爱情10
乡村爱情10下部资源谁有，分享一下呗,乡村爱情10
乡村爱情10.下半部分，今晚8点准时首播，大家对剧情有什么期,乡村爱情10
我看《乡村爱情》第10部――乡村爱情协奏曲,乡村爱情10
我看《乡村爱情》第10部――乡村爱情协奏曲,乡村爱情10
《乡村爱情》10部曲,乡村爱情10
乡村爱情10哪位大佬有啊……求啊😊,乡村爱情10
乡村爱情10下1-12集,乡村爱情10
谁有乡村爱情10的全集,乡村爱情10
乡村爱情10,乡村爱情10
乡村爱情10感觉小李老师还是喜欢白清明！,乡村爱情10
乡村爱情10里面的汽车牌照好几个一样的！,乡村爱情10
乡村爱情下《1-30集高清完整》，可以看了,乡村爱情10
乡村爱情10已有了,乡村爱情10
乡村爱情10小梁当官了吗,乡村爱情10
乡村爱情10下部3月12号播出,乡村爱情10
乡村爱情10上下两部《1-60集高清完整》，可以看了,乡村爱情10
乡村爱情10吓 🍀补😘权🍃急,乡村爱情10
乡村爱情10   1~12已get,乡村爱情10
乡村爱情10第30集采访大个的女记者是谁演的？,乡村爱情10
乡村爱情10下半部，今晚8.00首播。,乡村爱情10
乡村爱情10里面，赵本山买法斗是第多少级啊，求,乡村爱情10
当年乡村名流里的高长水在乡村爱情10里居然成了中年大叔,乡村爱情10
分享：🍃 好剧开播 《乡村爱情10》同步更新 🔥《谈判官》每晚同步,乡村爱情10
乡村爱情有第11部什么时候出 第10部播完还有续集吗,乡村爱情10
乡村爱情10为啥这二天不更新了,乡村爱情10
乡村爱情10下播出时间,乡村爱情10
求 乡村爱情10   第13级21分钟开始的唢呐配音 歌曲名字,乡村爱情10
乡村爱情10第二十三集这个地方用的背景音乐 有谁知道 求歌曲,乡村爱情10
白天看乡村爱情10，晚上在看一部叫越来越劲的电视剧，这部剧香,乡村爱情10
【投票】你认为乡村爱情从1到10里所有女演员最漂亮的是谁？（,乡村爱情10
乡村爱情10抢先看，谢大脚又要结婚了,乡村爱情10
《乡村爱情10》,乡村爱情10
03-12『进行曲』乡村爱情9小李住院是哪集呀？,乡村爱情10
我记得很久以前看 刘英不是生了双胞胎吗  现在乡村爱情10怎,乡村爱情10
不用网盘✔微_信～工—众一呺『逢君识光彩』回 “乡村爱情10,乡村爱情10
乡村爱情10里，美女的衣服是啥品牌的啊，觉得挺漂亮,乡村爱情10
乡村爱情10，玉田娘怎么改名了！,乡村爱情10
乡村爱情10,乡村爱情10
求救乡村爱情10中这个瓜果名称,乡村爱情10
